title,price,location,postdate
ROOM FOR RENT,$160,Rockdale,04/09/2020
Looking for nepalese couple or single for unit sharing,$250,Berala,04/09/2020
Rockdale Gardens Apartment - one big room for rent,$240,Rockdale,04/09/2020
A  big and bright room in Carlingford,$150,Carlingford,04/09/2020
"large room with large wardrobe & own fridge, clean, cosy, convienent",$220,Ashfield,04/09/2020
Shared House in Glebe,$300,Glebe,04/09/2020
Single bedroom with ensuite in Westmead,$200,Westmead,04/09/2020
House for rent,,Blacktown,04/09/2020
OWN SINGLE ROOM 245AUD PW ALL BILLS INCLUDED females only,$245,Randwick,04/09/2020
Room for rent in Wentworthville,$230,Wentworthville,04/09/2020
Room for Rent at Fairmount St (Close to Lakemba St),$160,Lakemba,04/09/2020
"Macquarie uni best room for rent-spacious, bright, quiet, clost to all",$200,Marsfield,04/09/2020
Room in rent available,$250,Ashfield,04/09/2020
"Macquarie uni best room for rent-spacious, bright, quiet, clost to all",$200,Marsfield,04/09/2020
Room in rent available,$250,Ashfield,04/09/2020
House for Share,$190,Dee Why,04/09/2020
Room for rent,$180,Kogarah Bay,04/09/2020
QUEEN SIZE ROOM (CLEANING & BILLS INCL.),$200,Wolli Creek,04/09/2020
Epping single room $200pw,$200,Epping,04/09/2020
Furnished Single Bedroom - Split Level Unit,$290,Zetland,04/09/2020
One bed room  in two bed room unit,$200,Auburn,04/09/2020
Room Available MASCOT,$340,St Peters,04/09/2020
Furnished Room Next to UNSW - Kingsford,$220,Kingsford,04/09/2020
Amazing waterfront Apartment for flatshare,$350,Queenscliff,04/09/2020
Second room for rent,$270,Mascot,04/09/2020
Padstow station 2 single rooms to rent,$175,Padstow,04/09/2020
Free room on beautiful farm ,,Windsor,04/09/2020
Own Master Room Sydney City All Bills included,$400,Sydney City,04/09/2020
City-Pyrmont   big double room $300( for two people ),$300,Pyrmont,04/09/2020
"Dee Why Beach - Couple/Single, One or two Rooms available",$320,Dee Why,04/09/2020
Blaxland Blue Mountains Houseshare,$215,Blaxland,04/09/2020
Shared Accomodation for students - 100$,$100,Westmead,04/09/2020
A private room in Lane Cove,$250,Lane Cove,04/09/2020
TWO Furnished room available,$1.15,South Penrith,04/09/2020
Large private ensuite room with built-ins in Bondi $365 per week,$365,Bondi,04/09/2020
AVAILABLE NOW - HURSTVILLE/ALLAWAH,$250,Hurstville,04/09/2020
second twin room $120/w male,$120,Pyrmont,04/09/2020
Randwick room to rent $140 per week 17 cowper st,$140,Randwick,04/09/2020
your own private spacious room at Burwood,$145,Burwood,04/09/2020
"Furnished double room for single $200/week, Ashfield",$200,Ashfield,04/09/2020
Private Room in Glebe,$270,Glebe,04/09/2020
Master room for girls only,$120,Pendle Hill,04/09/2020
Cleaned Room FOr ReNt,$170,St Marys,04/09/2020
Free ONE week RenT❤️*master room and study room ❤️upto $140❤️❤️❤️,$140,Macquarie Park,04/09/2020
1 master room| 1bathroom| 1 parking - Granville,$250,Granville,04/09/2020
Private Big Room In Greystanes ,$120,Parramatta,04/09/2020
Room for Rent,$160,St Marys,04/09/2020
Room for rent in Harris Park,$220,Harris Park,04/09/2020
Garden view rooms available in centre Leichhardt,$220,Leichhardt,04/09/2020
Room available,$280,Allawah,04/09/2020
Room for rent in GLENWOOD with BED ( Indian girl only ),$129,Glenwood,04/09/2020
We have a room to rent,$145,Lidcombe,04/09/2020
Private and furnished room kogarah,$220,Kogarah,04/09/2020
Room Available at Flemington ,$260,Homebush West,04/09/2020
Room for rent Kogarah,$200,Kogarah,04/09/2020
Close to UTS and University of Sydney,$180,Redfern,04/09/2020
Double bed room with en suite bathroom near Bankstown Airport AUD 240,$240,Georges Hall,04/09/2020
ROOM FOR RENT IN NEW TWO BEDROOMS UNIT IN NEXT TOO MERRLANDS STATION,$160,Merrylands,04/09/2020
Room for rent,$230,Westmead,04/09/2020
"Master Room with Separate Bathroom, 5 Minutes Walk to Station",$210,Parramatta,04/09/2020
Master Room for rent,$320,Burwood,04/09/2020
Room4Rent,$175,West Ryde,04/09/2020
Are you looking for a Nice place to Stay,$150,Auburn,04/09/2020
Sunny & furnished room to share in two bedrooms Granny Flat for rent,$200,Hornsby,04/09/2020
Spacious room in Liverpool available!,$160,Liverpool,04/09/2020
**$180/$125**DBL/SGL bed room in the clean flat,$180,Homebush West,04/09/2020
Room for rent,$180,Parramatta,04/09/2020
2 rooms for lease in Marsfield,$140,Marsfield,04/09/2020
Student Accommodation,$280,Allambie Heights,04/09/2020
Single Room Available,$225,Stanmore,04/09/2020
Furnished large room for rent in a house in casula,$175,Casula,04/09/2020
Sunny Room Becomes Available,$160,Redfern,04/09/2020
Room share,$150,Plumpton,04/09/2020
Room for Rent,$150,Marsfield,04/09/2020
Large room in spacious Victorian home,$240,Kogarah,04/09/2020
Blacktown share house,$160,Blacktown,04/09/2020
Furnished Room For Rent,$250,Auburn,04/09/2020
North Sydney STUDENTS PRIVATE and Twin Sharing Rooms for rent!!,$157,North Sydney,04/09/2020
A big room rent in North Ryde business area,$165,North Ryde,04/09/2020
"OWN furnished PRIVATE ROOM, Paddington",$260,Paddington,04/09/2020
Private room with own toilet available near St Peters Stn - Incl Bills,$275,Newtown,04/09/2020
"Lidcombe Private room, close to station and Woolworths. House share",$170,Lidcombe,04/09/2020
Accommodation Student Macquarie Uni,$170,Macquarie Park,04/09/2020
5  bedrooms for rent whole or share  gordon 2072,$150,Gordon,04/09/2020
Clean and spacious room in Ryde,$200,Ryde,04/09/2020
Clean and spacious room in Ryde,$200,Ryde,04/09/2020
Private room with bathroom for rent,$260,Mascot,04/09/2020
Very handy location available for sharing,,Wentworthville,04/09/2020
Bedroom available in Ermington,$190,Ermington,04/09/2020
BURWOOD: Room for rent for 4 months,$170,Burwood,04/09/2020
Zero Deposit 1 Bedroom,$180,Auburn,04/09/2020
House to Share: Manly Vale 3 bedrooms freestanding house w/ garden,$350,Manly Vale,04/09/2020
Wanted: flat share needed with Hilltop road public school catchment,,Merrylands,04/09/2020
SPACIOUS ROOM IN LARGE CHIPPENDALE TERRACE FOR RENT,$300,Chippendale,04/09/2020
Room in Lane Cove Penthouse - Bills and Cleaner included,$260,Lane Cove North,04/09/2020
Dulwich Hill-queer gay lesbian house double loft Aircon ALL bills!,$330,Newtown,04/09/2020
FEMALE ONLY - SINGLE ROOM FOR RENT IN MARRICKVILLE ,$220,Marrickville,04/09/2020
Room for rent in Harris Park nearer to station,$245,Harris Park,03/09/2020
Flatmates wanted in campbelltown,$140,Ruse,03/09/2020
Completely furnished Room for rent at west pennant hills,$270,West Pennant Hills,03/09/2020
Private room at Maroubra Beach,$200,Maroubra,03/09/2020
Room available in strathfield for sharing for Guy,$120,Strathfield,03/09/2020
Big Room near Parramatta CBD,$150,Parramatta,03/09/2020
Ryde Christian Share House Overheads Included,$400,Ryde,03/09/2020
Room for rent,$210,Ryde,03/09/2020
Sharing room available for girl at Kogarah,$115,Kogarah,03/09/2020
Room in Coogee available from 3/10.,$290,Coogee,03/09/2020
Furnished Rooms for Rent from $200 (Wi-Fi Provided),$200,Marsfield,03/09/2020
Student Accommodation In Sydney For A Reasonable Price,$100,Sydney City,03/09/2020
clean and new unit,$280,Haymarket,03/09/2020
Wanted: Eastwood - close to train station,$250,West Ryde,03/09/2020
"Private room, own bathroom + car space in Mascot",$320,Mascot,03/09/2020
"Room for Rent in leafy two level townhouse, Macquaire Park, North Ryde",$190,Macquarie Park,03/09/2020
Bankstown Apartment roomate  want,$170,Bankstown,03/09/2020
room for rent,$125,Wiley Park,03/09/2020
Room for rent,$100,Merrylands,03/09/2020
large room to rent in rockdale,$230,Rockdale,03/09/2020
Private sunny room,$160,Ultimo,03/09/2020
2 rooms in Hurstville,$150,Hurstville,03/09/2020
Big sunny master room in the heart of Randwick,$350,Randwick,03/09/2020
Room for rent,$200,Liverpool,03/09/2020
Master bedroom $270,,Waitara,03/09/2020
Room with separate bathroom for rent,$200,Bankstown,03/09/2020
ROOM FOR RENT,$170,Guildford,03/09/2020
ROOM FOR RENT,$270,Bondi Junction,03/09/2020
Flatmate needed in Freshly renovated apartment..,$225,North Parramatta,03/09/2020
Own Loft Room $160pw Inc Bills,$160,Dee Why,03/09/2020
Room available in Granville for  Nepalese,,Granville,03/09/2020
Room for Rent,$150,Riverwood,03/09/2020
Wanted: Room at Liverpool areas,$250,Liverpool,03/09/2020
Double room inner Sydney,$200,Newtown,03/09/2020
Independent Room for Rent,$210,Kogarah,03/09/2020
Room available in South Coogee,$290,South Coogee,03/09/2020
